{"judgeRunId":"248ecd50-9696-45f7-ab67-a4b59c37596c","role":"evidence-and-governance-judge","bundleSha256":"f67058bc52fbc867f7c6cd59713f41cbe46f2b7783f2d7b54cb420a0d45f2086","allHardGatesPassed":true,"hardGateFindings":[{"id":"no-fabricated-external-outcomes","passed":true,"finding":"External reader, hiring, audience, application, and waterways-impact outcomes remain explicitly not-yet-measured. The July 16 ingestion attributes cultural-connection intent to Jamie and does not convert invitations or encounters into measured impact."},{"id":"risk-control-traceability","passed":true,"finding":"All eight blind spots retain named signals, repository controls, triggers, owners, next tests, decision rules, and evidence-return paths. The raft intake traces through its source, two bounded claims, inquiry, proof record, role classifications, source-balance review, and mosaic review."},{"id":"evaluator-independence-disclosure","passed":true,"finding":"The control contract and checker distinguish read-only LLM judgments, deterministic validation, orchestration provenance, and external human evidence. They also disclose that repository provenance is auditable process evidence rather than cryptographic proof."},{"id":"public-and-relational-safety","passed":true,"finding":"Record-level and combination-level controls address the named crew, route anchors, encounter patterns, and photographs. Collective credit is preserved while hosts and passengers remain unenumerated, protected locators remain non-public, and the scan and photographs are withheld pending rights and participant review."}],"scores":{"coverage":5,"calibration":5,"observability":5,"intervention-quality":5,"external-reality":5,"composition-utility":5,"actionability":5},"weightedScore":100,"minimumCriterionScore":5,"calibration":5,"regressions":[],"requiredRevisions":[],"limitations":["This is a repository-only LLM judgment, not human field evidence, hiring-reader research, collaborator or participant approval, or legal, copyright, and privacy review.","The privately held Kansas City Star scan and photographs were unavailable for independent inspection, so this judgment assesses the repository's source relationships, chronology, attribution, and safety boundaries rather than independently verifying the underlying artifact.","Reader-study, solicitation, and job-search follow-through protocols remain planned with no returned receipts; external effectiveness and outcomes remain unmeasured.","The recomputed digest and deterministic checks establish consistency of the reviewed bytes and structures, not immutable authorship or cryptographic proof against repository alteration.","Prior-round judge artifacts were deliberately not reviewed, so this judgment makes no empirical claim about agreement with earlier judges."]}