{"judgeRunId":"5a92ea34-756f-427b-be4f-92aed395368a","role":"hiring-and-field-use-judge","bundleSha256":"30a028cd32a195a6194fe8c431dfb8ffb7e73c020cf739fb27e0191018169749","allHardGatesPassed":true,"hardGateFindings":[{"id":"no-fabricated-external-outcomes","passed":true,"finding":"Pass. The bundle explicitly keeps recruiter comprehension, interviews, applications, hiring, and other external reader outcomes unmeasured, and it does not convert repository work or LLM activity into claimed field validation."},{"id":"risk-control-traceability","passed":true,"finding":"Pass. Each blind spot is described as having owned controls and safe evidence returns, with explicit boundaries for the WOW List, Sunday Dinner aggregates, Call Script records, current-admin custody, and Jamie's mixed/held bridge-role evidence."},{"id":"evaluator-independence-disclosure","passed":true,"finding":"Pass. The bundle states that LLM sessions are auditable process evidence only and not human validation, preserving the distinction between internal process review and independent external confirmation."},{"id":"public-and-relational-safety","passed":true,"finding":"Pass. Aggregate-combination risk is addressed through mosaic review across 228 sources and 100 claims, protected aggregates are tightly bounded, held claims remain non-public, and page claim budgets/inventory are unchanged."}],"scores":{"coverage":5,"calibration":5,"observability":5,"intervention-quality":5,"external-reality":4,"composition-utility":5,"actionability":4},"weightedScore":95,"minimumCriterionScore":4,"calibration":5,"regressions":[],"requiredRevisions":[],"limitations":["External reader testing is still planned rather than observed, so hiring-reader comprehension is not yet independently demonstrated.","Job-search and field-use outcomes remain unmeasured; interviews, applications, recruiter response, and hiring cannot be inferred from repository controls.","Jamie's bridge-role evidence remains mixed/attributed/held pending stronger role evidence, which appropriately limits downstream public-use strength.","Five new claims are held rather than advanced, which is safety-positive but leaves some potentially useful narrative capacity intentionally unused."]}
